{
  "id": "base:credential_matches_person",
  "type": "rule",
  "name": "loc:rule.credential_matches_person",
  "explanation": "loc:rule.credential_matches_person.explanation",
  "applies_to": {
    "document_families": [
      "credential"
    ],
    "transaction_tags": [
      "official_visit"
    ]
  },
  "check": {
    "op": "matches_person",
    "field": "photo"
  },
  "severity": "blocking",
  "tier": 0
}
