{
  "id": "base:identity_not_expired",
  "type": "rule",
  "name": "loc:rule.identity_not_expired",
  "explanation": "loc:rule.identity_not_expired.explanation",
  "applies_to": {
    "document_families": [
      "identity"
    ],
    "transaction_tags": [
      "id_required",
      "age_restricted"
    ]
  },
  "check": {
    "op": "not_expired",
    "field": "expiry"
  },
  "severity": "blocking",
  "tier": 0
}
