{
  "id": "base:commercial_feature_carbon",
  "type": "rule",
  "name": "loc:rule.commercial_feature_carbon",
  "explanation": "loc:rule.commercial_feature_carbon.explanation",
  "applies_to": {
    "document_families": [
      "commercial"
    ],
    "transaction_tags": [
      "trade_in",
      "resale"
    ]
  },
  "check": {
    "op": "feature_present",
    "feature": "carbon_impression"
  },
  "severity": "blocking",
  "tier": 1,
  "requires_tool": "base:loupe"
}
