{
  "id": "base:identity_matches_person",
  "type": "rule",
  "name": "loc:rule.identity_matches_person",
  "explanation": "loc:rule.identity_matches_person.explanation",
  "applies_to": {
    "document_families": [
      "identity"
    ],
    "transaction_tags": [
      "id_required",
      "age_restricted"
    ]
  },
  "check": {
    "op": "matches_person",
    "field": "photo"
  },
  "severity": "blocking",
  "tier": 0
}
