{
  "id": "base:credential_not_expired",
  "type": "rule",
  "name": "loc:rule.credential_not_expired",
  "explanation": "loc:rule.credential_not_expired.explanation",
  "applies_to": {
    "document_families": [
      "credential"
    ],
    "transaction_tags": [
      "official_visit"
    ]
  },
  "check": {
    "op": "not_expired",
    "field": "expiry"
  },
  "severity": "blocking",
  "tier": 0
}
