{
  "id": "base:credential_typeface_matches",
  "type": "rule",
  "name": "loc:rule.credential_typeface_matches",
  "explanation": "loc:rule.credential_typeface_matches.explanation",
  "applies_to": {
    "document_families": [
      "credential"
    ],
    "transaction_tags": [
      "official_visit"
    ]
  },
  "check": {
    "op": "typeface_matches",
    "field": "typeface"
  },
  "severity": "advisory",
  "tier": 3,
  "requires_tool": "base:reference_binder"
}
