{
  "id": "base:credential_feature_uv",
  "type": "rule",
  "name": "loc:rule.credential_feature_uv",
  "explanation": "loc:rule.credential_feature_uv.explanation",
  "applies_to": {
    "document_families": [
      "credential"
    ],
    "transaction_tags": [
      "official_visit"
    ]
  },
  "check": {
    "op": "feature_present",
    "feature": "uv_seal"
  },
  "severity": "blocking",
  "tier": 1,
  "requires_tool": "base:uv_torch"
}
